{
  "message_type": "event",
  "message_id": "a0dd2be3-6375-4633-98a0-418dc8bfa60b",
  "schema": "ods.i8.piece_analysis",
  "schema_version": "1.0",
  "producer": "I8",
  "published_at": "2026-10-20T12:00:01.120Z",
  "captured_at": "2026-10-20T12:00:01.000Z",
  "source_id": "cam-linha1",
  "session_id": "c6d74fc3-6a32-42a9-b3fd-4866732db39d",
  "sequence": 30456,
  "artifact_version": "piece-cls-0.9.2",
  "payload": {
    "frame_index": 30456,
    "detection_id": 0,
    "bbox": [600, 220, 980, 610],
    "result": "NON_CONFORMING",
    "defect_class": "AMASSADO",
    "taxonomy_version": "defects-a1-1.0.0",
    "confidence": 0.88,
    "similarity": 0.61
  }
}
